{
  "$schema": "https://json-schema.org/draft/2020-12/schema",
  "title": "StoryForge production (story.json)",
  "type": "object",
  "required": ["schema_version", "slug", "canon", "brief", "state", "style_bible", "cast", "locations", "slides", "lines", "research", "source_work", "output"],
  "properties": {
    "schema_version": {"const": "1.0"},
    "slug": {"type": "string", "pattern": "^[a-z0-9][a-z0-9-]*$"},
    "canon": {
      "oneOf": [
        {"type": "null"},
        {
          "type": "object",
          "required": ["path", "chapters"],
          "properties": {
            "path": {"type": "string", "minLength": 1},
            "chapters": {"type": "array", "minItems": 1, "items": {"type": "string", "pattern": "^chapter-[0-9]{2,}$"}}
          }
        }
      ]
    },
    "brief": {
      "type": "object",
      "required": ["idea", "language", "aspect", "content_type", "genre", "target_seconds", "captions", "review_mode"],
      "properties": {
        "channel": {"type": "string", "pattern": "^[a-z0-9][a-z0-9-]*$"},
        "idea": {"type": "string", "minLength": 1},
        "language": {"type": "string", "pattern": "^[a-z]{2,3}(-[A-Za-z0-9]{2,8})*$"},
        "aspect": {"enum": ["9:16", "16:9"]},
        "content_type": {"enum": ["fiction", "factual", "adaptation"]},
        "genre": {"type": "string", "minLength": 1},
        "target_seconds": {"type": "integer", "minimum": 5},
        "captions": {
          "type": "object",
          "required": ["mode", "style"],
          "properties": {
            "mode": {"enum": ["karaoke", "plain", "none"]},
            "style": {"type": "string", "pattern": "^[a-z0-9-]+$"},
            "animation": {"enum": ["none", "pop_up", "slide_blur", "word_by_word"]}
          }
        },
        "review_mode": {"enum": ["gated", "auto"]},
        "loudness_lufs": {"type": "number", "minimum": -30, "maximum": -10},
        "outro_fade_s": {"type": "number", "minimum": 0, "maximum": 60}
      }
    },
    "state": {
      "type": "object",
      "required": ["stage", "gates"],
      "properties": {
        "stage": {"enum": ["brief", "idea", "canon", "research", "adapt", "checks", "gate1", "cast", "voice", "images", "gate2", "captions", "render", "qc", "done"]},
        "gates": {
          "type": "object",
          "required": ["script", "images"],
          "properties": {"script": {"$ref": "#/$defs/gate"}, "images": {"$ref": "#/$defs/gate"}}
        }
      }
    },
    "style_bible": {
      "type": "object",
      "required": ["medium", "palette", "lighting", "composition", "avoid"],
      "properties": {
        "medium": {"type": "string"},
        "palette": {"type": "array", "items": {"type": "string"}},
        "lighting": {"type": "string"},
        "composition": {"type": "string"},
        "avoid": {"type": "array", "items": {"type": "string"}}
      }
    },
    "cast": {"type": "array", "minItems": 1, "items": {"$ref": "#/$defs/cast_member"}},
    "locations": {"type": "array", "items": {"$ref": "#/$defs/location"}},
    "slides": {"type": "array", "minItems": 1, "items": {"$ref": "#/$defs/slide"}},
    "lines": {"type": "array", "minItems": 1, "items": {"$ref": "#/$defs/line"}},
    "research": {"oneOf": [{"type": "null"}, {"$ref": "#/$defs/research"}]},
    "source_work": {"oneOf": [{"type": "null"}, {"$ref": "#/$defs/source_work"}]},
    "seo": {
      "type": "object",
      "properties": {
        "title": {"type": "string", "minLength": 1},
        "description": {"type": "string"},
        "keywords": {"type": "array", "items": {"type": "string"}},
        "author": {"type": "string"},
        "hook_title_variants": {"type": "array", "items": {"type": "string"}},
        "zone1_hook": {"type": "string"},
        "zone2_body": {"type": "string"},
        "zone3_footer": {"type": "string"},
        "tags_block": {"type": "string"},
        "ai_disclosure": {"type": "string"},
        "pinned_comment": {"type": "string"}
      },
      "additionalProperties": false
    },
    "learnings_applied": {"type": "array", "items": {"type": "string"}},
    "output": {
      "type": "object",
      "required": ["video", "captions", "contact_sheet", "qc"],
      "properties": {
        "video": {"type": ["string", "null"]},
        "captions": {"type": ["string", "null"]},
        "contact_sheet": {"type": ["string", "null"]},
        "qc": {"type": ["string", "null"]},
        "thumbnail": {"type": ["string", "null"]},
        "thumbnail_16_9": {"type": ["string", "null"]}
      }
    }
  },
  "$defs": {
    "gate": {"type": "object", "required": ["approved_at"], "properties": {"approved_at": {"type": ["string", "null"]}}},
    "color": {"type": "string", "pattern": "^#[0-9A-Fa-f]{6}$"},
    "asset": {
      "type": "object",
      "required": ["path", "input_hash", "status", "attempts"],
      "properties": {
        "path": {"type": ["string", "null"]},
        "input_hash": {"type": ["string", "null"]},
        "status": {"enum": ["pending", "done", "failed", "needs_human"]},
        "attempts": {"type": "integer", "minimum": 0},
        "last_error": {"type": ["string", "null"]}
      }
    },
    "plate": {
      "allOf": [
        {"$ref": "#/$defs/asset"},
        {"type": "object", "required": ["prompt"], "properties": {"prompt": {"type": "string", "minLength": 1}}}
      ]
    },
    "voice": {
      "type": "object",
      "required": ["source", "profile_id"],
      "properties": {
        "source": {"enum": ["library", "design", "clone"]},
        "profile_id": {"type": ["string", "null"]},
        "library_ref": {"type": "string"},
        "design_prompt": {"type": "string"},
        "instruct": {"type": "string"},
        "speed": {"type": "number", "minimum": 0.5, "maximum": 2.0},
        "ref_audio": {"type": "string"},
        "ref_text": {"type": "string"}
      },
      "allOf": [
        {"if": {"properties": {"source": {"const": "library"}}}, "then": {"required": ["library_ref"]}},
        {"if": {"properties": {"source": {"const": "design"}}}, "then": {"required": ["design_prompt"]}},
        {"if": {"properties": {"source": {"const": "clone"}}}, "then": {"required": ["ref_audio"]}}
      ]
    },
    "anchor_traits": {
      "type": "object",
      "required": ["entity_type", "tokens"],
      "properties": {
        "entity_type": {"enum": ["human", "organism", "mechanical", "conceptual", "character", "location", "creature", "visual_asset", "generic_troop", "faction"]},
        "tokens": {"type": "string", "minLength": 1},
        "signature_clothing": {"type": "string"},
        "negative_archetypes": {"type": "array", "items": {"type": "string"}},
        "safety_filters": {"type": "array", "items": {"type": "string"}}
      }
    },
    "spatial_physics": {
      "type": "object",
      "properties": {
        "has_mechanical_action": {"type": "boolean"},
        "shot_pair_type": {"enum": ["trigger_setup", "vector_threat", "none"]},
        "paired_slide_id": {"type": ["string", "null"]},
        "contact_point": {"type": ["string", "null"]},
        "force_direction": {"type": ["string", "null"]},
        "physics_negatives": {"type": "array", "items": {"type": "string"}}
      }
    },
    "cast_member": {
      "type": "object",
      "required": ["id", "canon_id", "name", "role", "voice", "caption_color"],
      "properties": {
        "id": {"type": "string", "pattern": "^(narrator|C[0-9]{2,})$"},
        "canon_id": {"type": ["string", "null"]},
        "name": {"type": "string", "minLength": 1},
        "role": {"enum": ["narrator", "protagonist", "antagonist", "deuteragonist", "supporting", "minor"]},
        "appearance": {"type": "string"},
        "pronunciation": {"type": "string"},
        "role_alias": {"type": "string"},
        "safety_view": {"enum": ["front", "back_view", "side_profile", "silhouette", "unrestricted"]},
        "safety_level": {"type": "integer", "minimum": 1, "maximum": 4},
        "anchor_traits": {"$ref": "#/$defs/anchor_traits"},
        "wardrobe_states": {
          "type": "object",
          "additionalProperties": {"type": "string"}
        },
        "voice": {"$ref": "#/$defs/voice"},
        "caption_color": {"$ref": "#/$defs/color"},
        "plates": {
          "type": "object",
          "required": ["face", "half", "full"],
          "properties": {
            "face": {"$ref": "#/$defs/plate"},
            "half": {"$ref": "#/$defs/plate"},
            "full": {"$ref": "#/$defs/plate"}
          },
          "additionalProperties": false
        }
      }
    },
    "location": {
      "type": "object",
      "required": ["id", "canon_id", "name", "appearance", "plate"],
      "properties": {
        "id": {"type": "string", "pattern": "^LOC[0-9]{2,}$"},
        "canon_id": {"type": ["string", "null"]},
        "name": {"type": "string", "minLength": 1},
        "appearance": {"type": "string", "minLength": 1},
        "era_anchors": {"type": "string"},
        "architectural_dna": {"type": "string"},
        "lighting_palette": {"type": "string"},
        "negative_filters": {"type": "array", "items": {"type": "string"}},
        "plate": {"$ref": "#/$defs/plate"}
      }
    },
    "slide": {
      "type": "object",
      "required": ["id", "source", "line_ids", "brief", "visual", "image"],
      "properties": {
        "id": {"type": "string", "pattern": "^S[0-9]{2,}$"},
        "source": {"type": ["string", "null"]},
        "line_ids": {"type": "array", "minItems": 1, "items": {"type": "string", "pattern": "^L[0-9]{3,}$"}},
        "brief": {
          "type": "object",
          "required": ["moment", "characters", "location", "must_show", "must_not_show", "continuity", "beat"],
          "properties": {
            "moment": {"type": "string", "minLength": 1},
            "characters": {"type": "array", "items": {"type": "string"}},
            "location": {"type": ["string", "null"]},
            "must_show": {"type": "array", "items": {"type": "string"}},
            "must_not_show": {"type": "array", "items": {"type": "string"}},
            "continuity": {"type": "array", "items": {"type": "string"}},
            "beat": {"enum": ["setup", "question", "reveal", "reversal", "emotional", "resolution"]},
            "spatial_physics": {"$ref": "#/$defs/spatial_physics"}
          }
        },
        "visual": {
          "type": "object",
          "required": ["prompt", "shot", "motion", "text_placement"],
          "properties": {
            "prompt": {"type": "string", "minLength": 1},
            "shot": {"enum": ["extreme-close", "close-up", "medium", "wide", "extreme-wide"]},
            "motion": {"enum": ["static", "push_in", "pull_out", "pan_left", "pan_right", "dolly_in", "dolly_out", "tilt_up", "tilt_down", "tracking", "gimbal_glide", "handheld", "whip_pan", "arc_shot"]},
            "text_placement": {"enum": ["lower_third", "center", "upper_third"]},
            "camera_movement": {"type": "string"},
            "focal_length": {"type": "string"},
            "camera_angle": {"type": "string"}
          }
        },
        "image": {
          "allOf": [
            {"$ref": "#/$defs/asset"},
            {"type": "object", "required": ["seed"], "properties": {"seed": {"type": ["integer", "null"]}}}
          ]
        }
      }
    },
    "word": {
      "type": "object",
      "required": ["text", "start_ms", "end_ms", "approx"],
      "properties": {
        "text": {"type": "string"},
        "start_ms": {"type": "integer", "minimum": 0},
        "end_ms": {"type": "integer", "minimum": 0},
        "approx": {"type": "boolean"}
      }
    },
    "line": {
      "type": "object",
      "required": ["id", "speaker", "text", "whisper", "pause_after_ms", "claim_ids", "audio", "words", "words_hash"],
      "properties": {
        "id": {"type": "string", "pattern": "^L[0-9]{3,}$"},
        "speaker": {"type": "string"},
        "text": {"type": "string", "minLength": 1},
        "whisper": {"type": "boolean"},
        "pause_after_ms": {"type": "integer", "minimum": 0, "maximum": 10000},
        "claim_ids": {"type": "array", "items": {"type": "string"}},
        "audio": {
          "allOf": [
            {"$ref": "#/$defs/asset"},
            {
              "type": "object",
              "required": ["duration_ms", "seed", "qc", "asr_words"],
              "properties": {
                "duration_ms": {"type": ["integer", "null"], "minimum": 1},
                "seed": {"type": ["integer", "null"]},
                "used_seed": {"type": ["integer", "null"]},
                "qc": {"type": ["object", "null"]},
                "asr_words": {"type": ["array", "null"]}
              }
            }
          ]
        },
        "words": {"type": "array", "items": {"$ref": "#/$defs/word"}},
        "words_hash": {"type": ["string", "null"]}
      }
    },
    "research": {
      "type": "object",
      "required": ["notes", "claims"],
      "properties": {
        "notes": {
          "type": "array",
          "items": {
            "type": "object",
            "required": ["id", "title", "sources", "status"],
            "properties": {
              "id": {"type": "string", "pattern": "^R[0-9]{2,}$"},
              "title": {"type": "string"},
              "sources": {"type": "array", "items": {"type": "string"}},
              "status": {"enum": ["open", "verified", "disputed"]},
              "accuracy": {"enum": ["must-be-accurate", "blended", "invented"]},
              "confidence": {"enum": ["high", "medium", "low"]},
              "checked_on": {"type": ["string", "null"]},
              "risk": {"type": "array", "items": {"enum": ["legal", "medical", "weapons", "safety", "cultural", "defamation", "technical"]}}
            }
          }
        },
        "claims": {
          "type": "array",
          "items": {
            "type": "object",
            "required": ["id", "text", "status", "note_ids"],
            "properties": {
              "id": {"type": "string", "pattern": "^CL[0-9]{2,}$"},
              "text": {"type": "string"},
              "status": {"enum": ["verified", "unverified", "interpretation"]},
              "note_ids": {"type": "array", "items": {"type": "string"}},
              "limitations": {"type": "string"}
            }
          }
        }
      }
    },
    "source_work": {
      "type": "object",
      "required": ["title", "author", "rights_basis", "translation_used"],
      "properties": {
        "title": {"type": "string"},
        "author": {"type": "string"},
        "rights_basis": {"type": "string"},
        "translation_used": {"type": ["string", "null"]}
      }
    }
  }
}
