{
  "schema_version": "1.0",
  "slug": "smoke-test",
  "canon": null,
  "brief": {
    "idea": "Why the sky is blue and sunsets are orange, in thirty seconds.",
    "language": "en",
    "aspect": "9:16",
    "content_type": "factual",
    "genre": "science-explainer",
    "target_seconds": 30,
    "captions": {"mode": "karaoke", "style": "karaoke-bold"},
    "review_mode": "gated"
  },
  "state": {"stage": "cast", "gates": {"script": {"approved_at": "2026-09-28"}, "images": {"approved_at": null}}},
  "style_bible": {
    "medium": "soft painterly digital illustration",
    "palette": ["sky blue", "warm orange", "deep navy"],
    "lighting": "natural daylight, golden hour for sunset scenes",
    "composition": "one clear subject, open sky, clean lower third for captions",
    "avoid": ["generated text", "logos", "watermarks", "photorealistic faces"]
  },
  "cast": [
    {
      "id": "narrator",
      "canon_id": null,
      "name": "Narrator",
      "role": "narrator",
      "voice": {"source": "design", "design_prompt": "male, middle-aged, low pitch, american accent", "profile_id": null},
      "caption_color": "#FFFFFF"
    },
    {
      "id": "C01",
      "canon_id": null,
      "name": "Kid",
      "role": "supporting",
      "appearance": "curious 9-year-old with a yellow raincoat and short curly hair",
      "voice": {"source": "design", "design_prompt": "female, child, high pitch, american accent", "profile_id": null},
      "caption_color": "#FFD166",
      "plates": {
        "face": {"prompt": "Soft painterly digital illustration, portrait of a curious 9-year-old with short curly hair and a yellow raincoat, neutral background, facing the viewer, no text, no logos.", "path": null, "input_hash": null, "status": "pending", "attempts": 0, "last_error": null},
        "half": {"prompt": "Soft painterly digital illustration, half-body view of a curious 9-year-old with short curly hair in a yellow raincoat, hands in pockets, neutral background, no text, no logos.", "path": null, "input_hash": null, "status": "pending", "attempts": 0, "last_error": null},
        "full": {"prompt": "Soft painterly digital illustration, full-body view of a curious 9-year-old with short curly hair in a yellow raincoat and rain boots, standing, neutral background, no text, no logos.", "path": null, "input_hash": null, "status": "pending", "attempts": 0, "last_error": null}
      }
    }
  ],
  "locations": [
    {
      "id": "LOC01",
      "canon_id": null,
      "name": "Grassy hill",
      "appearance": "a gentle grassy hill under a wide open sky",
      "plate": {"prompt": "Soft painterly digital illustration, a gentle grassy hill under a wide open clear blue sky, no people, vertical composition, no text, no logos.", "path": null, "input_hash": null, "status": "pending", "attempts": 0, "last_error": null}
    }
  ],
  "slides": [
    {
      "id": "S01",
      "source": null,
      "line_ids": ["L001", "L002"],
      "brief": {"moment": "The kid looks up at a bright blue sky", "characters": ["C01"], "location": "LOC01", "must_show": ["clear blue sky"], "must_not_show": ["sunset"], "continuity": ["yellow raincoat"], "beat": "question"},
      "visual": {"prompt": "Soft painterly digital illustration, a curious 9-year-old in a yellow raincoat standing on a grassy hill, looking up at a vast clear blue sky, wide shot, clean lower third, no text, no logos.", "shot": "wide", "motion": "push_in", "text_placement": "lower_third"},
      "image": {"path": null, "input_hash": null, "status": "pending", "attempts": 0, "last_error": null, "seed": 101}
    },
    {
      "id": "S02",
      "source": null,
      "line_ids": ["L003"],
      "brief": {"moment": "White sunlight scatters off tiny air molecules", "characters": [], "location": null, "must_show": ["white light splitting into blue scatter"], "must_not_show": [], "continuity": [], "beat": "reveal"},
      "visual": {"prompt": "Soft painterly digital illustration, a beam of white sunlight entering the atmosphere and scattering blue light off tiny glowing air molecules, dark navy space above, clean lower third, no text, no labels, no logos.", "shot": "extreme-wide", "motion": "pan_right", "text_placement": "lower_third"},
      "image": {"path": null, "input_hash": null, "status": "pending", "attempts": 0, "last_error": null, "seed": 102}
    },
    {
      "id": "S03",
      "source": null,
      "line_ids": ["L004"],
      "brief": {"moment": "Blue light reaches the kid's eyes from every direction", "characters": ["C01"], "location": "LOC01", "must_show": ["blue light from all directions"], "must_not_show": [], "continuity": ["yellow raincoat"], "beat": "reveal"},
      "visual": {"prompt": "Soft painterly digital illustration, a curious 9-year-old in a yellow raincoat on a grassy hill, soft blue light rays arriving from every direction of the sky toward the child, medium shot, clean lower third, no text, no logos.", "shot": "medium", "motion": "static", "text_placement": "lower_third"},
      "image": {"path": null, "input_hash": null, "status": "pending", "attempts": 0, "last_error": null, "seed": 103}
    },
    {
      "id": "S04",
      "source": null,
      "line_ids": ["L005", "L006"],
      "brief": {"moment": "The same hill at sunset, glowing orange", "characters": ["C01"], "location": "LOC01", "must_show": ["orange sunset"], "must_not_show": [], "continuity": ["yellow raincoat"], "beat": "resolution"},
      "visual": {"prompt": "Soft painterly digital illustration, a curious 9-year-old in a yellow raincoat sitting on a grassy hill at sunset, warm orange and pink sky near a low sun, wide shot, clean lower third, no text, no logos.", "shot": "wide", "motion": "pull_out", "text_placement": "lower_third"},
      "image": {"path": null, "input_hash": null, "status": "pending", "attempts": 0, "last_error": null, "seed": 104}
    }
  ],
  "lines": [
    {"id": "L001", "speaker": "narrator", "text": "Look up on a clear day, and the sky is blue. But sunlight is white.", "whisper": false, "pause_after_ms": 300, "claim_ids": ["CL01"], "audio": {"path": null, "duration_ms": null, "seed": null, "input_hash": null, "status": "pending", "attempts": 0, "last_error": null, "qc": null, "asr_words": null}, "words": [], "words_hash": null},
    {"id": "L002", "speaker": "C01", "text": "So where does the blue come from?", "whisper": false, "pause_after_ms": 400, "claim_ids": [], "audio": {"path": null, "duration_ms": null, "seed": null, "input_hash": null, "status": "pending", "attempts": 0, "last_error": null, "qc": null, "asr_words": null}, "words": [], "words_hash": null},
    {"id": "L003", "speaker": "narrator", "text": "Tiny molecules in the air scatter short blue wavelengths much more than long red ones.", "whisper": false, "pause_after_ms": 300, "claim_ids": ["CL02"], "audio": {"path": null, "duration_ms": null, "seed": null, "input_hash": null, "status": "pending", "attempts": 0, "last_error": null, "qc": null, "asr_words": null}, "words": [], "words_hash": null},
    {"id": "L004", "speaker": "narrator", "text": "That scattered blue light reaches your eyes from every part of the sky. [pause 300ms] So the whole sky glows blue.", "whisper": false, "pause_after_ms": 400, "claim_ids": ["CL02"], "audio": {"path": null, "duration_ms": null, "seed": null, "input_hash": null, "status": "pending", "attempts": 0, "last_error": null, "qc": null, "asr_words": null}, "words": [], "words_hash": null},
    {"id": "L005", "speaker": "C01", "text": "Then why are sunsets orange?", "whisper": false, "pause_after_ms": 300, "claim_ids": [], "audio": {"path": null, "duration_ms": null, "seed": null, "input_hash": null, "status": "pending", "attempts": 0, "last_error": null, "qc": null, "asr_words": null}, "words": [], "words_hash": null},
    {"id": "L006", "speaker": "narrator", "text": "At sunset, light crosses much more air, so most of the blue is scattered away before it reaches you.", "whisper": false, "pause_after_ms": 500, "claim_ids": ["CL03"], "audio": {"path": null, "duration_ms": null, "seed": null, "input_hash": null, "status": "pending", "attempts": 0, "last_error": null, "qc": null, "asr_words": null}, "words": [], "words_hash": null}
  ],
  "research": {
    "notes": [
      {"id": "R01", "title": "Rayleigh scattering", "sources": ["https://en.wikipedia.org/wiki/Rayleigh_scattering"], "status": "verified", "accuracy": "must-be-accurate", "confidence": "high", "checked_on": "2026-09-28", "risk": []}
    ],
    "claims": [
      {"id": "CL01", "text": "Sunlight contains all visible wavelengths and appears white.", "status": "verified", "note_ids": ["R01"]},
      {"id": "CL02", "text": "Air molecules scatter shorter (blue) wavelengths much more strongly than longer (red) ones, which makes the daytime sky blue.", "status": "verified", "note_ids": ["R01"]},
      {"id": "CL03", "text": "At sunset sunlight travels through more atmosphere, so more blue is scattered out of the direct path and the sun and sky look orange-red.", "status": "verified", "note_ids": ["R01"]}
    ]
  },
  "source_work": null,
  "learnings_applied": [],
  "output": {"video": null, "captions": null, "contact_sheet": null, "qc": null}
}
